Evangelical Lutheran Church Social Service-Hong Kong Easy Escort Service,基督教香港信義會社會服務部 外出易-陪診及護送服務,基督教香港信义会社会服务部 外出易-陪诊及护送服务,Evangelical Lutheran Church Social Service - HK,基督教香港信義會社會服務部,基督教香港信义会社会服务部,Innovative Project/Venture,創新計劃,创新计划,Impact Incubator programme run by the Hong Kong Council of Social Service,由香港社會服務聯會推展的Impact Incubator 計劃,由香港社会服务联会推展的Impact Incubator 计划,Scale-up,擴大規模,扩大规模,Healthcare,醫,医,Elderly,長者,长者,"Using IT platform to help empower the underprivileged to provide escort services for the elderly and persons with disabilities, benefiting all parties involved  ",利用資訊科技平台讓弱勢社群為長者及復康人士提供陪診服務，多方共贏,利用资讯科技平台让弱势社群为长者及复康人士提供陪诊服务，多方共赢,"‧Recruited 89 part-time care workers for out-patient escort service‧Recruited 44 ""Escort Ambassadors"" to serve people in need‧Provided about 100 times of free escort service and over 15000 hours of paid escort service to the elderly and PWDs‧Developed and launched different IT systems or mobile app to support the ordering, communication, work scheduling and payment of the escort service",‧已招募89名兼職陪診員‧已招募44名「護送天使」‧向長者及殘疾人士提供了近100次免費及超過15 000小時的收費陪診服務‧推出不同電腦平台系統及應用程式，以支援陪診服務的預約、溝通、工時編排和付款工作,‧已招募89名兼职陪诊员‧已招募44名「护送天使」‧向长者及残疾人士提供了近100次免费及超过15 000小时的收费陪诊服务‧推出不同电脑平台系统及应用程式，以支援陪诊服务的预约、沟通、工时编排和付款工作,421933,421933,421933,24.00,24.00,24.00,Completed,已完成,已完成,www.elchk.org.hk/service,www.elchk.org.hk/service,www.elchk.org.hk/service
“Our Everyday. Our Borders.” A Study of Universal Accessibility in Our City,「日常. 邊界.」香港城市環境通用設計研習,「日常. 边界.」香港城市环境通用设计研习,The Chinese University of Hong Kong,香港中文大學,香港中文大学,Research,研究,研究,N/A,不適用,不适用,N/A,不適用,不适用,Community participation,社區參與,社区参与,Elderly,長者,长者,"A team comprising doctors, architects and urban planners will design an elderly-friendly walkable city. Elderly are encouraged to go out, explore the “treasures” in the city and voice out their views on universal accessibility of the built environment.",由醫生、建築師和城市規劃師組成的團隊將設計一個適合長者徒步遊歷的香港，鼓勵長者探索城市中的寶藏、參與社區並表達他們對城市環境的看法。,由医生、建筑师和城市规划师组成的团队将设计一个适合长者徒步游历的香港，鼓励长者探索城市中的宝藏、参与社区并表达他们对城市环境的看法。,"This project takes actions in creating Hong Kong as a walkable city for the elders. With a project team of doctors, architects and urban planners, elders are encouraged to go out and explore the “treasures” in the city, and to voice out their views on universal accessibility of the built environment through the program designed with lectures, architectural guided tours, place audits and workshops for the elderly. Target beneficiaries include elders, students, architects and planners as well as general public.",項目通過由醫生、建築師和城市規劃師組成的團隊，設計香港成為一個適合長者的步行的城市，鼓勵長者探索城市中的寶藏，參與社區並表達他們對城市環境的看法。受惠者主要包括長者及參與設計研習人士。,项目通过由医生、建筑师和城市规划师组成的团队，设计香港成为一个适合长者的步行的城市，鼓励长者探索城市中的宝藏，参与社区并表达他们对城市环境的看法。受惠者主要包括长者及参与设计研习人士。,400000,400000,400000,32.0,32.0,32.0,Active,推展中,推展中,,,
3D-printed Soft Robotic Hand for Stroke Rehabilitation,「軟件希望之手」中風患者復康治療,「软件希望之手」中风患者复康治疗,The Chinese University of Hong Kong,香港中文大學,香港中文大学,Research,研究,研究,N/A,不適用,不适用,N/A,不適用,不适用,Healthcare,醫,医,Persons with disabilities,殘疾人士,残疾人士,"Rehabilitation training with a personalised, affordable, multi-functional 3D-printed soft robotic hand will be developed to facilitate hand function recovery for stroke rehabilitation patients so that they can reintegrate into society.",開發一套中風復康訓練方案，配合以3D打印技術製造輕便、價錢相宜的多功能「軟件希望之手」，提升中風康復者的手部活動功能，協助他們重投社會。,开发一套中风复康训练方案，配合以3D打印技术制造轻便、价钱相宜的多功能「软件希望之手」，提升中风康复者的手部活动功能，协助他们重投社会。,"This project aims to develop a stroke rehabilitation training with an affordable 3D-printed soft robotic hand based on the team’s recent patented technology of Soft-Elastic Composite Actuator to facilitate better hand recovery on more stroke survivors and elderly in society through the training sessions with the soft robotic hand, and to 3D-print soft robotic hands with the team’s advanced design and control algorithm to provide more hand function tasks training in a more affordable way.",本研究項目旨在研發「軟件希望之手」，配合3D技術，期望產品可以為每個人度身訂造，而且更輕、更舒適及更經濟實惠的電動輔助儀器，以幫助中風患者及長者強化腦部對手掌的控制，提升他們的手部活動能力，從而改善他們的日常生活重新融入社會。受惠者主要包括手部殘疾人士(例如中風患者)及長者。,本研究项目旨在研发「软件希望之手」，配合3D技术，期望产品可以为每个人度身订造，而且更轻、更舒适及更经济实惠的电动辅助仪器，以帮助中风患者及长者强化脑部对手掌的控制，提升他们的手部活动能力，从而改善他们的日常生活重新融入社会。受惠者主要包括手部残疾人士(例如中风患者)及长者。,400000,400000,400000,24.0,24.0,24.0,Completed,已完成,已完成,,,
A Concept Musical Drama on End-of-life Care and Death Attitudes in Hong Kong,香港晚期照顧及死亡態度之概念舞台音樂劇,香港晚期照顾及死亡态度之概念舞台音乐剧,The Chinese University of Hong Kong,香港中文大學,香港中文大学,Research,研究,研究,N/A,不適用,不适用,N/A,不適用,不适用,Others,其他,其他,Others,其他,其他,The project aims to highlight the quality end-of-life care and debunk some of the misconceptions and misunderstanding towards death-related matters in Hong Kong and disseminate research findings on end-of-life care through seminars. The research findings will be presented in the form of muscial drama later. ,項目旨在探討有關晚期照顧及死亡態度的概念，帶出體驗“好死”及有質素的晚期照顧的困難，駁斥對死亡相關事宜的錯誤觀念和的誤解，並透過座談會宣揚有關晚期照顧的研究結果。研究結果亦會編制成舞台音樂劇，於日後公演。,项目旨在探讨有关晚期照顾及死亡态度的概念，带出体验“好死”及有质素的晚期照顾的困难，驳斥对死亡相关事宜的错误观念和的误解，并透过座谈会宣扬有关晚期照顾的研究结果。研究结果亦会编制成舞台音乐剧，于日后公演。,The project aims to highlight the quality end-of-life care and debunk some of the misconceptions and misunderstanding towards death-related matters in Hong Kong and disseminate research findings on end-of-life care through seminars. The research findings will be presented in the form of muscial drama later. ,項目旨在探討有關晚期照顧及死亡態度的概念，帶出體驗“好死”及有質素的晚期照顧的困難，駁斥對死亡相關事宜的錯誤觀念和的誤解，並透過座談會宣揚有關晚期照顧的研究結果。研究結果亦會編制成舞台音樂劇，於日後公演。,项目旨在探讨有关晚期照顾及死亡态度的概念，带出体验“好死”及有质素的晚期照顾的困难，驳斥对死亡相关事宜的错误观念和的误解，并透过座谈会宣扬有关晚期照顾的研究结果。研究结果亦会编制成舞台音乐剧，于日后公演。,400000,400000,400000,30.0,30.0,30.0,Active,推展中,推展中,,,
"A Phone Reassurance Elderly Project (PREP) for Connecting Elders and Youth: Training, Communication, Health Knowledge Transfer",透過長者電話服務計劃連結長者與年輕人：訓練，溝通，健康知識轉移,透过长者电话服务计划连结长者与年轻人：训练，沟通，健康知识转移,The Chinese University of Hong Kong,香港中文大學,香港中文大学,Research,研究,研究,N/A,不適用,不适用,N/A,不適用,不适用,Healthcare,醫,医,Elderly,長者,长者,The project aims to implement a phone reassurance for elders with a group of inter-professional service-learning team to provide healthcare service.,項目透過由一群跨學科大學生組成的服務學習團隊推行電話服務計劃，為長者提供醫療服務。,项目透过由一群跨学科大学生组成的服务学习团队推行电话服务计划，为长者提供医疗服务。,"In this project, students will be given the opportunities to learn through practice in transferring accurate and valid health knowledge. Meanwhile, loneliness of elders will be reduced by creating deeper interactions in conversations. An age-friendly and cohesive community will be built to connect the two generations. Health knowledge for both youth and elderly will be enhanced.",在這個項目中，學生有機會通過練習來學習正確和有效的健康知識。同時，透過在對話中進行深層次的互動，長者的孤獨感得以減少，並建立年齡友好和具凝聚力的社區，以連接兩代人。青年和老年人的健康知識也將獲加強。,在这个项目中，学生有机会通过练习来学习正确和有效的健康知识。同时，透过在对话中进行深层次的互动，长者的孤独感得以减少，并建立年龄友好和具凝聚力的社区，以连接两代人。青年和老年人的健康知识也将获加强。,400000,400000,400000,12.0,12.0,12.0,Active,推展中,推展中,,,
AI-based Colour Blindness Correction App,人工智能色盲輔助程式,人工智能色盲辅助程式,The Chinese University of Hong Kong,香港中文大學,香港中文大学,Research,研究,研究,N/A,不適用,不适用,N/A,不適用,不适用,Healthcare,醫,医,Persons with disabilities,殘疾人士,残疾人士,"The project will devise an AI-based colour blindness correction solution applicable to various platforms such as smart glasses and digital displays. Its real-time, high-quality colour improvement effect will help people with colour vision deficiency to distinguish colours in daily life.",研究內容為開發人工智能色盲輔助程式，應用於不同的電子平台例如智能眼鏡和各種數碼顯示器，為色盲人士實時矯正色彩，幫助他們在日常生活中分辨顏色。,研究内容为开发人工智能色盲辅助程式，应用于不同的电子平台例如智能眼镜和各种数码显示器，为色盲人士实时矫正色彩，帮助他们在日常生活中分辨颜色。,"This project aims to help people with colour vision deficiency to distinguish colours in daily life. In form of an app with AI-based colour blindness correction algorithm, it allows real-time effect with a very high quality colour improvement effect for the colour-blind, applicable to various platforms e.g. smart glasses, digital displays.  Target beneficiaries include people with colour vision deficiency.",項目旨在利用人工智能色盲輔助程式幫助有色盲的視障人士來區分日常生活中的色彩，有色盲的視障人士可以透過程式輔助，實時矯正色彩。程式可適用於不同的電子平台，例如：智能眼鏡，不同數碼顯示器。受惠者主要包括視障人士。,项目旨在利用人工智能色盲辅助程式帮助有色盲的视障人士来区分日常生活中的色彩，有色盲的视障人士可以透过程式辅助，实时矫正色彩。程式可适用于不同的电子平台，例如：智能眼镜，不同数码显示器。受惠者主要包括视障人士。,400000,400000,400000,24.0,24.0,24.0,Active,推展中,推展中,,,
Enhancing Mental Health of the Deaf Community in Hong Kong,聾人精神健康計劃,聋人精神健康计划,The Chinese University of Hong Kong,香港中文大學,香港中文大学,Research,研究,研究,N/A,不適用,不适用,N/A,不適用,不适用,Healthcare,醫,医,Persons with disabilities,殘疾人士,残疾人士,This project aims to enhance the mental health of hearing-impaired persons in Hong Kong by enhancing mental health literacy of deaf signers and help mental health personnel to learn basic HK Sign Language. It will translate the mental health literacy questionnaire into HK Sign Language and build an online databank containing sign-bilingual mental health information.,透過將精神健康問卷翻譯成手語以及構建一個手語和中文雙語的網上精神健康數據庫等措施，項目提升本港聽障人士的精神健康，並幫助精神健康專家學習基礎手語。,透过将精神健康问卷翻译成手语以及构建一个手语和中文双语的网上精神健康数据库等措施，项目提升本港听障人士的精神健康，并帮助精神健康专家学习基础手语。,"This project aims to enhance the mental health of hearing-impaired persons in Hong Kong by enhancing mental health literacy of deaf signers and help mental health personnel to learn basic HK Sign Language. It will translate the mental health literacy questionnaire into HK Sign Language and build an online databank containing sign-bilingual mental health information. The target beneficiaries include deaf signers in Hong Kong, family members of deaf signers, friends of deaf people, teachers for the deaf, and the professionals who need to serve deaf clients.",透過將精神健康問卷翻譯成手語以及構建一個手語和中文雙語的網上精神健康數據庫等措施，項目提升本港聽障人士的精神健康，並幫助精神健康專家學習基礎手語。受惠者主要包括聾人及其親友。,透过将精神健康问卷翻译成手语以及构建一个手语和中文双语的网上精神健康数据库等措施，项目提升本港听障人士的精神健康，并帮助精神健康专家学习基础手语。受惠者主要包括聋人及其亲友。,400000,400000,400000,24.0,24.0,24.0,Active,推展中,推展中,,,
Hip Protectors to Prevent Hip Fracture of Older Adults in Hospitals and Nursing Homes,髖部保護器：預防醫院和療養院長者的髖部骨折,髋部保护器：预防医院和疗养院长者的髋部骨折,The Chinese University of Hong Kong,香港中文大學,香港中文大学,Research,研究,研究,N/A,不適用,不适用,N/A,不適用,不适用,Healthcare,醫,医,Elderly,長者,长者,This project aims to work with stakeholders and introduce effective and affordable hip protectors in hospitals and nursing homes to facilitate hip fracture prevention for the elderly.,項目旨在與各持分者共同研發高效用而價錢相宜的髖部保護器並推廣至醫院及療養院應用，以助長者預防因意外跌倒而引致的髖部骨折。,项目旨在与各持分者共同研发高效用而价钱相宜的髋部保护器并推广至医院及疗养院应用，以助长者预防因意外跌倒而引致的髋部骨折。,This project aims to work with stakeholders and introduce effective and affordable hip protectors in hospitals and nursing homes to facilitate hip fracture prevention for the elderly. The target beneficiaries include older adults and caregivers.,項目旨在與各持分者共同研發高效用而價錢相宜的髖部保護器並推廣至醫院及療養院應用，以助長者預防因意外跌倒而引致的髖部骨折。受惠者主要是社區內的長者及照顧者。,项目旨在与各持分者共同研发高效用而价钱相宜的髋部保护器并推广至医院及疗养院应用，以助长者预防因意外跌倒而引致的髋部骨折。受惠者主要是社区内的长者及照顾者。,400000,400000,400000,24.0,24.0,24.0,Active,推展中,推展中,,,
Music Playgroup to Enhance Language Development in Infants and Toddlers: A Pilot Community Program,透過親子音樂遊戲小組促進嬰幼兒語言發展﹕社區試驗計劃,透过亲子音乐游戏小组促进婴幼儿语言发展﹕社区试验计划,The Chinese University of Hong Kong,香港中文大學,香港中文大学,Research,研究,研究,N/A,不適用,不适用,N/A,不適用,不适用,Education and learning,教育與學習,教育与学习,Children and youth,兒童及青少年,儿童及青少年,The project aims to offer music playgroups to improve language and neurocognitive development of infants and toddlers who are at risk for future language development in Hong Kong.,項目旨在透過舉行音樂遊戲小組，以提高嬰幼兒的語言發展和神經認知能力。,项目旨在透过举行音乐游戏小组，以提高婴幼儿的语言发展和神经认知能力。,"The high quality cognitively stimulating activities will be available for children at risk for language impairment. This aims at children who are ranked low among peers in terms of language and communication skills. Besides, the online delivery platform will bring the cost of playgroups down so that more families can afford.",優質的認知刺激活動將提供予有機會患上語言障礙的兒童，對象以在語言和溝通技巧方面在同齡人中排名較低的孩子為主。 此外，網上平台將降低遊戲小組的成本，從而使更多家庭負擔得起。,优质的认知刺激活动将提供予有机会患上语言障碍的儿童，对象以在语言和沟通技巧方面在同龄人中排名较低的孩子为主。 此外，网上平台将降低游戏小组的成本，从而使更多家庭负担得起。,400000,400000,400000,24.0,24.0,24.0,Active,推展中,推展中,,,
Real-time Chinese Sentence Learning Platform for Ethnic Minority Students,少數族裔學生實時中文句子學習平台,少数族裔学生实时中文句子学习平台,The Chinese University of Hong Kong,香港中文大學,香港中文大学,Research,研究,研究,N/A,不適用,不适用,N/A,不適用,不适用,Education and learning,教育與學習,教育与学习,People of diverse race,不同種族人士,不同种族人士,"This project aims to establish an open learning platform and provide a real-time demonstration of how a Chinese sentence is made up of characters, words and constituent phrases to help non-Chinese speaking students learn Chinese more effectively.",項目旨在建立一個中文網上學習平台，就用家輸入的中文句子，實時、有系統地分析其組成部份，包括字、詞和短語，期望幫助非華語學生更有效地學習中文。,项目旨在建立一个中文网上学习平台，就用家输入的中文句子，实时、有系统地分析其组成部份，包括字、词和短语，期望帮助非华语学生更有效地学习中文。,"This project aims to establish an open learning platform and provide a real-time demonstration of how a Chinese sentence is made up of characters, words and constituent phrases to help non-Chinese speaking students learn Chinese more effectively. The target beneficiaries include non-Chinese speaking students in Hong Kong and their teachers/instructors and any interested Chinese sentence learners in the globe.",本研究項目旨在建立一個中文網上學習平台，就用家輸入的中文句子，提供實時解說，有系統地分析組成句子的各部份，包括漢字及其部件、詞語和短語，期望幫助非華語學生更有效地學習中文，消除語言障礙，提升他們的就業競爭力。受惠者主要包括非華語學生、其老師/導師以及世界各地有興趣學習中文句子的人士。,本研究项目旨在建立一个中文网上学习平台，就用家输入的中文句子，提供实时解说，有系统地分析组成句子的各部份，包括汉字及其部件、词语和短语，期望帮助非华语学生更有效地学习中文，消除语言障碍，提升他们的就业竞争力。受惠者主要包括非华语学生、其老师/导师以及世界各地有兴趣学习中文句子的人士。,400000,400000,400000,24.0,24.0,24.0,Completed,已完成,已完成,,,
Self-management Program for People with Mild Neurocognitive Disorder,「健康由我管」 輕度認知障礙自我管理課程,「健康由我管」 轻度认知障碍自我管理课程,The Chinese University of Hong Kong,香港中文大學,香港中文大学,Research,研究,研究,N/A,不適用,不适用,N/A,不適用,不适用,Healthcare,醫,医,Elderly,長者,长者,"Patients with mild neurocognitive disorder are the ultimate beneficiaries. Staff from participating organisations will be trained to deliver interventions covering healthy diet, physical exercises, psychosocial coping and social engagement, etc.",本項目開發一個針對輕度認知障礙患者需要的自我管理課程，參與的機構員工將接受培訓，學習為有輕度認知障礙人士提供涵蓋飲食、運動、社交心理等支援，幫助受助人士實踐健康生活。,本项目开发一个针对轻度认知障碍患者需要的自我管理课程，参与的机构员工将接受培训，学习为有轻度认知障碍人士提供涵盖饮食、运动、社交心理等支援，帮助受助人士实践健康生活。,"This project aims to develop a chronic disease self-management program for local community-dwelling people with mild neurocognitivedisorder (MNCD), in order to help them better manage their lives physically, psychologically, socially, so as to maintain their functioning and delay further deterioration. The beneficiaries then can adopt a healthier daily livesand back to live and work in the society as normal people.",本研究項目旨在開發一個自我管理課程，幫助有輕度認知障礙人士實踐健康生活。參與項目的機構員工將接受培訓，學習為有輕度認知障礙人士提供涵蓋健康飲食、運動、社交心理等的支援。他們的支援體驗將被整合，供其他前線工作人員參考。受惠者主要包括有輕度認知障礙人士及有關的前線工作人員。,本研究项目旨在开发一个自我管理课程，帮助有轻度认知障碍人士实践健康生活。参与项目的机构员工将接受培训，学习为有轻度认知障碍人士提供涵盖健康饮食、运动、社交心理等的支援。他们的支援体验将被整合，供其他前线工作人员参考。受惠者主要包括有轻度认知障碍人士及有关的前线工作人员。,400000,400000,400000,18.0,18.0,18.0,Completed,已完成,已完成,,,
Sustainable communities lab for people’s multifaceted well-being,豐盛生命：可持續市區實驗室,丰盛生命：可持续市区实验室,The Chinese University of Hong Kong,香港中文大學,香港中文大学,Research,研究,研究,N/A,不適用,不适用,N/A,不適用,不适用,Community participation,社區參與,社区参与,Others,其他,其他,"By conducting a series of community workshops/labs, this project enhances community leaders' literacy and practical skills in making ecological and people-oriented urban spaces, with the ultimate goal of building sustainable communities and cities and enhancing community psychological well-being.",項目旨在透過舉辦一連串工作坊和實驗來增強社區領袖對建設可持續及人性化市區的認識和應用，藉改善社區環境來提升居民的心理健康。,项目旨在透过举办一连串工作坊和实验来增强社区领袖对建设可持续及人性化市区的认识和应用，藉改善社区环境来提升居民的心理健康。,"By conducting a series of community workshops/labs, this project enhances community leaders' literacy and practical skills in making ecological and people-oriented urban spaces, with the ultimate goal of building sustainable communities and cities and enhancing community psychological well-being. The target beneficiaries include District Council members and their assistants, as well as the general public.",項目旨在透過舉辦一連串工作坊和實驗來增強社區領袖對建設可持續及人性化市區的認識和應用，藉改善社區環境來提升居民的心理健康。受惠者主要包括各區區議員、區議員助理和一般市民大眾。,项目旨在透过举办一连串工作坊和实验来增强社区领袖对建设可持续及人性化市区的认识和应用，藉改善社区环境来提升居民的心理健康。受惠者主要包括各区区议员、区议员助理和一般市民大众。,400000,400000,400000,12.0,12.0,12.0,Active,推展中,推展中,,,
