Good House Project,【好宅】配對先導計劃,【好宅】配对先导计划,(Individual),（個人）,（个人）,Innovative Project/Venture,創新計劃,创新计划,Impact Incubator programme run by the Hong Kong Council of Social Service,由香港社會服務聯會推展的Impact Incubator 計劃,由香港社会服务联会推展的Impact Incubator 计划,Prototype,原型,原型,Living,住,住,Low-income families,低收入家庭,低收入家庭,A social property agent that links up conscientious flat owners with tenants of subdivided flats,連繫良心業主和板間房住戶的社會地產中介,连系良心业主和板间房住户的社会地产中介,"‧Linked up ten grassroots households with four conscientious flat owners to sign the fair tenancy agreement‧Provided removal services, furniture and home appliances to the tenants‧Organised about 20 exhibition booths and seminars to promote tenant protection",‧連結了十戶基層家庭和四名業主簽訂良心租約‧提供搬屋支援服務、傢俬及電器予租戶‧舉辦了約20場街站和講座宣傳租務保障,‧连结了十户基层家庭和四名业主签订良心租约‧提供搬屋支援服务、家私及电器予租户‧举办了约20场街站和讲座宣传租务保障,100000,100000,100000,8.00,8.00,8.00,Completed,已完成,已完成,www.facebook.com/GoodhouseHK/,www.facebook.com/GoodhouseHK/,www.facebook.com/GoodhouseHK/
Grassroots INFO,「草祉」流動附屬應用程式,「草祉」流动附属应用程式,Concern for Grassroots' Livelihood Alliance Limited,關注草根生活聯盟有限公司,关注草根生活联盟有限公司,Innovative Project/Venture,創新計劃,创新计划,Impact Incubator programme run by the Hong Kong Council of Social Service,由香港社會服務聯會推展的Impact Incubator 計劃,由香港社会服务联会推展的Impact Incubator 计划,Prototype,原型,原型,Others,其他,其他,Low-income families,低收入家庭,低收入家庭,A mobile app providing information on government social welfare schemes for easy access by the underprivileged,利用流動應用程式讓有需要人士更方便獲取有關政府福利的資訊 ,利用流动应用程式让有需要人士更方便获取有关政府福利的资讯 ,N/A,不適用,不适用,100000,100000,100000,24.00,24.00,24.00,Terminated,已終止,已终止,,,
GreenPrice,綠惜超級市場,绿惜超级市场,Green Price Limited,綠惜超級市場有限公司,绿惜超级市场有限公司,Innovative Project/Venture,創新計劃,创新计划,Good Seed programme run by the PolyU Technology and Consultancy Co Ltd,由理大科技及顧問有限公司推展的「好薈社」計劃,由理大科技及顾问有限公司推展的「好荟社」计划,Prototype,原型,原型,Food,食,食,Low-income families,低收入家庭,低收入家庭,A supermarket that addresses actively the environment and food poverty issues,一間積極解決環保和食物貧窮問題的食品市場,一间积极解决环保和食物贫穷问题的食品市场,"‧Agreements signed with seven suppliers to obtain products in form of special discount offer, consignment and donation‧Online and offline sale channels developed and a warehouse set up‧Set up pop-up stores on weekends and public holidays‧Donated part of goods or products to grassroots families via a partnering NGO",‧與七家供應商簽訂協議，獲對方以優惠價、寄賣和捐贈形式供貨‧已建立網上及實體銷售渠道，並成立儲存倉‧在周末及公眾假期設置臨時銷售攤位‧與一間非政府組織合作，捐贈部分貨品予基層家庭,‧与七家供应商签订协议，获对方以优惠价、寄卖和捐赠形式供货‧已建立网上及实体销售渠道，并成立储存仓‧在周末及公众假期设置临时销售摊位‧与一间非政府组织合作，捐赠部分货品予基层家庭,100000,100000,100000,6.00,6.00,6.00,Completed,已完成,已完成,www.greenprice.hk,www.greenprice.hk,www.greenprice.hk
HappiKamiWorkshop,亂摺24,乱折24,(Individual),（個人）,（个人）,Innovative Project/Venture,創新計劃,创新计划,Good Seed programme run by the PolyU Technology and Consultancy Co Ltd,由理大科技及顧問有限公司推展的「好薈社」計劃,由理大科技及顾问有限公司推展的「好荟社」计划,Prototype,原型,原型,Education and learning,教育與學習,教育与学习,Children and youth,兒童及青少年,儿童及青少年,Unleashing the talent of SEN students while facilitating inclusive education,透過摺紙開發SEN學生的多方面能力並促進融合教育,透过折纸开发SEN学生的多方面能力并促进融合教育,"‧Confirmed the course plan of the origami workshop and collected views from professionals in related fields (e.g. psychologist, behavior therapist, teacher, etc.) to fine-tune the workshop‧Conducted 14 origami workshops for SEN students to interact with other students and unleash their creativity",‧落實摺紙工作坊的內容，並收集相關專家（例如心理學家、行為治療師和老師等）的意見以優化內容‧已進行14個摺紙工作坊，讓SEN學生與其他學生交流互動，發揮創意,‧落实折纸工作坊的内容，并收集相关专家（例如心理学家、行为治疗师和老师等）的意见以优化内容‧已进行14个折纸工作坊，让SEN学生与其他学生交流互动，发挥创意,100000,100000,100000,9.00,9.00,9.00,Completed,已完成,已完成,www.happihood.com,www.happihood.com,www.happihood.com
Heartrip,心歷遊,心历游,(Individual),（個人）,（个人）,Innovative Project/Venture,創新計劃,创新计划,Good Seed programme run by the PolyU Technology and Consultancy Co Ltd,由理大科技及顧問有限公司推展的「好薈社」計劃,由理大科技及顾问有限公司推展的「好荟社」计划,Prototype,原型,原型,Job training and opportunities,工作培訓和就業機會,工作培训和就业机会,Persons with disabilities,殘疾人士,残疾人士,Experiential community tours in which persons with disabilities play different roles while utilising their talents,由殘疾人士負責策劃、營運和帶領社區體驗交流團，讓他們在不同崗位上發揮所長,由残疾人士负责策划、营运和带领社区体验交流团，让他们在不同岗位上发挥所长,Career training and job opportunities provided to 9 persons with disabilities,提供工作培訓和就業機會予9位殘疾人士,提供工作培训和就业机会予9位残疾人士,100000,100000,100000,12.00,12.00,12.00,Completed,已完成,已完成,,,
Ideas for Good,Ideas for Good,Ideas for Good,(Individual),（個人）,（个人）,Innovative Project/Venture,創新計劃,创新计划,Impact Incubator programme run by the Hong Kong Council of Social Service,由香港社會服務聯會推展的Impact Incubator 計劃,由香港社会服务联会推展的Impact Incubator 计划,Prototype,原型,原型,Education and learning,教育與學習,教育与学习,Persons with disabilities,殘疾人士,残疾人士,Training up the visually impaired as coaches to advocate positive values,培養視障人士成為導師宣揚正面價值,培养视障人士成为导师宣扬正面价值,"‧Provided 30 hours of coaching Foundation Course to 10 visually impaired (VI) candidates. Eight of them had attained Mastery Practitioner of The International Association of Coaching.‧Arranged each of the VI coach to provide over 20 hours of life coaching at Coaching Cafe Platform.‧Held the ""Dot.Coaching Graduation Ceremony"" to celebrate the achievements of the VI coaches in May 2017.",‧向10名視障人士提供30小時的人生教練培訓，其中8人考獲國際教練協會的專業教練資格‧安排每位視障教練在Coaching Cafe 平台上實習超過20小時和分享他們的人生價值‧在2017年5月舉辦「Dot.教練畢業典禮」以慶賀視障教練的成就,‧向10名视障人士提供30小时的人生教练培训，其中8人考获国际教练协会的专业教练资格‧安排每位视障教练在Coaching Cafe 平台上实习超过20小时和分享他们的人生价值‧在2017年5月举办「Dot.教练毕业典礼」以庆贺视障教练的成就,100000,100000,100000,12.00,12.00,12.00,Completed,已完成,已完成,http://www.thecoachingdot.com/,http://www.thecoachingdot.com/,http://www.thecoachingdot.com/
IRIS,IRIS,IRIS,(Individual),（個人）,（个人）,Innovative Project/Venture,創新計劃,创新计划,Innovator Farm programme run by the Fullness Social Enterprises Society Ltd,由豐盛社企學會有限公司推展的「創新園」計劃,由丰盛社企学会有限公司推展的「创新园」计划,Prototype,原型,原型,Education and learning,教育與學習,教育与学习,People of diverse race,不同種族人士,不同种族人士,Providing online board game interest classes to help non-Chinese speaking primary school students learn Chinese,提供網上桌上遊戲興趣班協助非華語小學生學習中文,提供网上桌上游戏兴趣班协助非华语小学生学习中文,1. Provide 270 Chinese classes using board games to 270 non-Chinese speaking primary school students2. Hire 9 non-Chinese speaking teachers who are fluent in Cantonese,1. 提供270堂中文桌上遊戲教學予270名非華語小學生2. 聘用9位通曉廣東話的非華語導師  ,1. 提供270堂中文桌上游戏教学予270名非华语小学生2. 聘用9位通晓广东话的非华语导师  ,100000,100000,100000,12.00,12.00,12.00,Active,推展中,推展中,,,
iSEE Mobile Apps,便利眼手機應用程式,便利眼手机应用程式,(Individual),（個人）,（个人）,Innovative Project/Venture,創新計劃,创新计划,Good Seed programme run by the PolyU Technology and Consultancy Co Ltd,由理大科技及顧問有限公司推展的「好薈社」計劃,由理大科技及顾问有限公司推展的「好荟社」计划,Prototype,原型,原型,Living,住,住,Persons with disabilities,殘疾人士,残疾人士,Mobile applications that bring convenience to visually impaired persons,為視障人士帶來便利的流動應用程式,为视障人士带来便利的流动应用程式,"‧Launched the features of recognition of colours, objects and different banknotes (including Hong Kong dollar, Renminbi, New Taiwan dollar and Macau Pataca) to bring convenience to VIPs in daily life",‧推出流動應用程式的辨認顏色、物件及多種鈔票（包括港幣、人民幣、新台幣及澳門幣）功能，讓視障人士的日常生活更便利,‧推出流动应用程式的辨认颜色、物件及多种钞票（包括港币、人民币、新台币及澳门币）功能，让视障人士的日常生活更便利,100000,100000,100000,6.00,6.00,6.00,Completed,已完成,已完成,iseemobile.com,iseemobile.com,iseemobile.com
iSTEM AI Lab,iSTEM AI 實驗室,iSTEM AI 实验室,iSTEM Limited,iSTEM Limited,iSTEM Limited,Innovative Project/Venture,創新計劃,创新计划,Good Seed programme run by the PolyU Technology and Consultancy Co Ltd,由理大科技及顧問有限公司推展的「好薈社」計劃,由理大科技及顾问有限公司推展的「好荟社」计划,Prototype,原型,原型,Education and learning,教育與學習,教育与学习,Children and youth,兒童及青少年,儿童及青少年,STEM learning package specially designed for students with special education needs,為有特殊教育需要學生研發的STEM學習方案,为有特殊教育需要学生研发的STEM学习方案,Completed the development of online STEM learning package with the aid of Artificial Intelligence,完成網上人工智能STEM學習套件的研發,完成网上人工智能STEM学习套件的研发,100000,100000,100000,9.00,9.00,9.00,Completed,已完成,已完成,,,
JA Future of Job Series: eSports,JA未來工作 - 電競,JA未来工作 - 电竞,Junior Achievement (Hong Kong) Limited,青年成就(香港)有限公司,青年成就(香港)有限公司,Innovative Project/Venture,創新計劃,创新计划,Impact Incubator programme run by the Hong Kong Council of Social Service,由香港社會服務聯會推展的Impact Incubator 計劃,由香港社会服务联会推展的Impact Incubator 计划,Prototype,原型,原型,Job training and opportunities,工作培訓和就業機會,工作培训和就业机会,Children and youth,兒童及青少年,儿童及青少年,Providing opportunities to help students from grassroots families develop a career in eSports,提供機會協助基層家庭學生在電競行業發展事業,提供机会协助基层家庭学生在电竞行业发展事业,- Held two workshops on career opportunities of eSports industry for 154 secondary or tertiary students from grassroots families- Organised 15 sessions of job shadowing/internship activities- Placed 22 students to join job shadowing/internship programmes,- 舉辦兩場工作坊，向154名基層中學生/大專生介紹電競行業的事業發展機會- 籌辦15場工作影子或實習活動- 安排22名學生參與工作影子或實習計劃,- 举办两场工作坊，向154名基层中学生/大专生介绍电竞行业的事业发展机会- 筹办15场工作影子或实习活动- 安排22名学生参与工作影子或实习计划,100000,100000,100000,11.00,11.00,11.00,Completed,已完成,已完成,www.jahk.org,www.jahk.org,www.jahk.org
J-Care,日照計劃,日照计划,(Individual),（個人）,（个人）,Innovative Project/Venture,創新計劃,创新计划,Impact Incubator programme run by the Hong Kong Council of Social Service,由香港社會服務聯會推展的Impact Incubator 計劃,由香港社会服务联会推展的Impact Incubator 计划,Prototype,原型,原型,Healthcare,醫,医,Others,其他,其他,"Experiential learning course comprising VR videos, professionals' sharing and talks to enhance caregivers' understanding of elderly's needs",結合VR短片、專業人士分享和講座的體驗課程，加深護理人員對長者需要的認識 ,结合VR短片、专业人士分享和讲座的体验课程，加深护理人员对长者需要的认识 ,80 healthcare workers will participate in the course,80名護理從業員參與課程,80名护理从业员参与课程,100000,100000,100000,24.00,24.00,24.00,Active,推展中,推展中,,,
JUST CLIMB PowerUP!,JUST CLIMB 「升呢」日記,JUST CLIMB 「升呢」日记,JUST CLIMB Association Limited,香港攀石訓練學會有限公司,香港攀石训练学会有限公司,Innovative Project/Venture,創新計劃,创新计划,"BEHub programme run by The Society of Rehabilitation and Crime Prevention, Hong Kong",由香港善導會推展的「社創社」計劃,由香港善导会推展的「社创社」计划,Prototype,原型,原型,Job training and opportunities,工作培訓和就業機會,工作培训和就业机会,Children and youth,兒童及青少年,儿童及青少年,"Young people from low-income families and rehabilitated persons will be recruited and trained as rock climbing instructors. The training will cover communication skills, safety instruction and rock climbing skills. Trainees will receive a cash allowance during the training period. After training, they will work with other instructors to coach rock climbing on fun days which will be organised for children and youths from different families including low-income ones to participate for free. ",項目招募更生人士和來自低收入家庭的年輕人參加，提供培訓令他們成為攀石教練。培訓內容涵蓋溝通技巧、安全指導和攀石技巧。學員在接受培訓期間可領取現金津貼。完成培訓後，他們將與其他攀石教練一起在抱石同樂日中指導參加者攀石技巧。抱石同樂日將舉辦多次，來自不同家庭包括低收入家庭的兒童和青少年可免費參加。,项目招募更生人士和来自低收入家庭的年轻人参加，提供培训令他们成为攀石教练。培训内容涵盖沟通技巧、安全指导和攀石技巧。学员在接受培训期间可领取现金津贴。完成培训后，他们将与其他攀石教练一起在抱石同乐日中指导参加者攀石技巧。抱石同乐日将举办多次，来自不同家庭包括低收入家庭的儿童和青少年可免费参加。,"	To train four young people from low-income families and four rehabilitated persons to become rock climbing instructors through five training sessions	To organise six fun days for 120 children and youths, including 60 from low-income families",	透過五堂課培訓四名來自低收入家庭的年輕人和四名更生人士成為攀石教練	為120名兒童和青少年舉辦六次抱石同樂日，當中60名來自低收入家庭,	透过五堂课培训四名来自低收入家庭的年轻人和四名更生人士成为攀石教练	为120名儿童和青少年举办六次抱石同乐日，当中60名来自低收入家庭,100000,100000,100000,12.00,12.00,12.00,Active,推展中,推展中,,,
Just Feel,感講,感讲,(Individual),（個人）,（个人）,Innovative Project/Venture,創新計劃,创新计划,Good Seed programme run by the PolyU Technology and Consultancy Co Ltd,由理大科技及顧問有限公司推展的「好薈社」計劃,由理大科技及顾问有限公司推展的「好荟社」计划,Prototype,原型,原型,Education and learning,教育與學習,教育与学习,Children and youth,兒童及青少年,儿童及青少年,To develop a series of educational products and services to aid primary schools in conducting social-emotional education,開發一系列?育產品和服務，支援小學推行社交及情緒教育,开发一系列?育产品和服务，支援小学推行社交及情绪教育,‧60 trial lessons/workshops be conducted‧240 sets of Non-violent Communication learning cards be produced‧500 primary students from underprivileged groups to benefit,‧進行60堂試行課堂或工作坊‧推出240套根據「善意溝通」模型設計的「Just Feel 感受需要卡」‧預計500名來自弱勢社群的小學生受惠,‧进行60堂试行课堂或工作坊‧推出240套根据「善意沟通」模型设计的「Just Feel 感受需要卡」‧预计500名来自弱势社群的小学生受惠,100000,100000,100000,9.00,9.00,9.00,Completed,已完成,已完成,www.justfeel.hk,www.justfeel.hk,www.justfeel.hk
KOElderly,KOElderly  ,KOElderly  ,(Individual),（個人）,（个人）,Innovative Project/Venture,創新計劃,创新计划,Innovator Farm programme run by the Fullness Social Enterprises Society Ltd,由豐盛社企學會有限公司推展的「創新園」計劃,由丰盛社企学会有限公司推展的「创新园」计划,Prototype,原型,原型,Job training and opportunities,工作培訓和就業機會,工作培训和就业机会,Elderly,長者,长者,Setting up an elderly KOL platform and providing relevant training for the elderly,建立長者KOL平台並為長者提供相關訓練,建立长者KOL平台并为长者提供相关训练,"- Collaborate with 2 elderly centres to recruit 6 members for a KOL trial and produce 12 videos- Provide 2 KOL training classes for 20 elderly people, expecting to groom 10 of them to become KOLs ",- 跟兩間長者中心合作，讓6位長者體驗成為KOL，拍攝12條影片- 為20 位長者提供兩班KOL培訓班，期望當中10位長者成爲KOL ,- 跟两间长者中心合作，让6位长者体验成为KOL，拍摄12条影片- 为20 位长者提供两班KOL培训班，期望当中10位长者成为KOL ,100000,100000,100000,12.00,12.00,12.00,Active,推展中,推展中,,,
Lay,匿,匿,(Individual),（個人）,（个人）,Innovative Project/Venture,創新計劃,创新计划,Innovator Farm programme run by the Fullness Social Enterprises Society Ltd,由豐盛社企學會有限公司推展的「創新園」計劃,由丰盛社企学会有限公司推展的「创新园」计划,Prototype,原型,原型,Others,其他,其他,Children and youth,兒童及青少年,儿童及青少年,A space designed with multiple stress-relieving elements for users to relieve stress and release emotions,一個融合多個紓壓設計元素的空間，讓使用者紓緩情緒及適時減壓,一个融合多个纾压设计元素的空间，让使用者纾缓情绪及适时减压,1. Set up one LAY Room as showcase2. Organise experiential workshops for 100 participants3. Set up one Office LAY for corporates,1. 建立1 間「匿」展示室2. 100 名參加者體驗「匿」3. 為公司建立1 間Office LAY  ,1. 建立1 间「匿」展示室2. 100 名参加者体验「匿」3. 为公司建立1 间Office LAY  ,100000,100000,100000,12.00,12.00,12.00,Active,推展中,推展中,,,
Legacy transformation - The museum of love,告別衣戀博物館——遺物整理與轉化,告别衣恋博物馆——遗物整理与转化,Hong Kong Hospice Social Worker Society,香港寧養社會工作者學會,香港宁养社会工作者学会,Innovative Project/Venture,創新計劃,创新计划,"BEHub programme run by The Society of Rehabilitation and Crime Prevention, Hong Kong",由香港善導會推展的「社創社」計劃,由香港善导会推展的「社创社」计划,Prototype,原型,原型,Job training and opportunities,工作培訓和就業機會,工作培训和就业机会,Low-income families,低收入家庭,低收入家庭,"By organising “legacy transformation” workshops, the venture aims to raise public awareness of life and death education, help the bereaved cope with grief, as well as provide job opportunities to women from low-income families.Eight workshops will be organised. At the workshops, the bereaved are encouraged to re-sew the clothes of their loved ones into other products (e.g. pillows or key pouches), through which they will receive life and death education. Four training sessions on life and death education and sewing skills will be provided to women from low-income families who, upon completion of training, will be employed to assist social workers in organising workshops. ",項目希望藉舉辦「遺物轉化」工作坊，提高大眾對生死教育的認識、幫助喪親者應對悲傷，以及提供工作機會予來自低收入家庭的婦女。項目將舉行八次工作坊，鼓勵喪親者將親人的衣服重新縫製成其他產品（例如攬枕或鑰匙包），從中向他們提供生死教育。項目也會向來自低收入家庭的婦女提供四場關於生死教育和縫紉技能的培訓，這些婦女完成培訓後，將獲聘協助社工舉行工作坊。,项目希望藉举办「遗物转化」工作坊，提高大众对生死教育的认识、帮助丧亲者应对悲伤，以及提供工作机会予来自低收入家庭的妇女。项目将举行八次工作坊，鼓励丧亲者将亲人的衣服重新缝制成其他产品（例如揽枕或钥匙包），从中向他们提供生死教育。项目也会向来自低收入家庭的妇女提供四场关于生死教育和缝纫技能的培训，这些妇女完成培训后，将获聘协助社工举行工作坊。,	To provide four training sessions and job opportunities to four women from low-income families	To organise eight “legacy transformation” workshops for 12 youths and 60 members of the public	To organise one exhibition for promoting life and death education,	提供四場培訓及工作機會予四名來自低收入家庭的婦女	為12名青年和60名公眾人士舉辦八次「遺物轉化」工作坊	舉辦一場展覽以推廣生死教育,	提供四场培训及工作机会予四名来自低收入家庭的妇女	为12名青年和60名公众人士举办八次「遗物转化」工作坊	举办一场展览以推广生死教育,100000,100000,100000,12.00,12.00,12.00,Active,推展中,推展中,https://hkhsws.com/,https://hkhsws.com/,https://hkhsws.com/
Lighten Dementia,認知障礙訓練遊戲,认知障碍训练游戏,Yusha Design Limited,用者設計有限公司,用者设计有限公司,Innovative Project/Venture,創新計劃,创新计划,Good Seed programme run by the PolyU Technology and Consultancy Co Ltd,由理大科技及顧問有限公司推展的「好薈社」計劃,由理大科技及顾问有限公司推展的「好荟社」计划,Prototype,原型,原型,Healthcare,醫,医,Elderly,長者,长者,Design and production of game-based cognitive training products for elderly with dementia and their caregivers,設計及製作遊戲形式的訓練產品，回應認知障礙症長者及照顧者的需要,设计及制作游戏形式的训练产品，回应认知障碍症长者及照顾者的需要,"- Created 3 types of cognitive training product prototypes and produced 600 sets of products- Conducted four group sharing sessions, four game workshops and two training sessions for elderly with dementia and caregivers to collect their feedback on the prototypes and raise their awareness on cognitive training",- 製作三款認知訓練產品原型並生產共600套產品- 舉辦共四場小組分享、四場遊戲工作坊及兩場訓練活動予患有認知障礙症的長者和他們的照顧者，以收集他們對產品原型的意見和提升他們對認知訓練的了解,- 制作三款认知训练产品原型并生产共600套产品- 举办共四场小组分享、四场游戏工作坊及两场训练活动予患有认知障碍症的长者和他们的照顾者，以收集他们对产品原型的意见和提升他们对认知训练的了解,100000,100000,100000,12.00,12.00,12.00,Completed,已完成,已完成,,,
