FammateHK,家家輔友,家家辅友,(Individual),（個人）,（个人）,Innovative Project/Venture,創新計劃,创新计划,Good Seed programme run by the PolyU Technology and Consultancy Co Ltd,由理大科技及顧問有限公司推展的「好薈社」計劃,由理大科技及顾问有限公司推展的「好荟社」计划,Prototype,原型,原型,Education and learning,教育與學習,教育与学习,Children and youth,兒童及青少年,儿童及青少年,Producing a tool kit and launching a community education programme for positive character education,製作正向品格教育工具箱及推出相關社區教育計劃 ,制作正向品格教育工具箱及推出相关社区教育计划 ,- Develop 300 sets of tool kits- Conduct 6 training and practical sessions under the community/school-based education programm,- 製作300套工具箱- 在社區／校本教育計劃下舉辦6場培訓和實踐活動,- 制作300套工具箱- 在社区／校本教育计划下举办6场培训和实践活动,200000,200000,200000,9.00,9.00,9.00,Active,推展中,推展中,fammatehk.org,fammatehk.org,fammatehk.org
G6PDia,豆仔生活百科,豆仔生活百科,G6PDia Limited,豆仔生活百科有限公司,豆仔生活百科有限公司,Innovative Project/Venture,創新計劃,创新计划,Good Seed programme run by the PolyU Technology and Consultancy Co Ltd,由理大科技及顧問有限公司推展的「好薈社」計劃,由理大科技及顾问有限公司推展的「好荟社」计划,Prototype,原型,原型,Living,住,住,Others,其他,其他,A one-stop platform to support parents with kids suffering from glucose-6-phosphate dehydrogenase deficiency,為患葡萄糖六磷酸去氫酵素缺乏症兒童的家長提供支援的一站式平台,为患葡萄糖六磷酸去氢酵素缺乏症儿童的家长提供支援的一站式平台,．Over 3 000 products are available on the online database for parents to search and identify products applicable to kids with G6PD deficiency．Over 11 000 persons have registered as members at the platformavailable on the online database for parents’ reference,．網上資料庫提供逾 3 000 種產品的資料讓家長搜尋和挑選適合患G6PD缺乏症兒童的產品．逾 11 000 名人士於平台上註冊成為會員,．网上资料库提供逾 3 000 种产品的资料让家长搜寻和挑选适合患G6PD缺乏症儿童的产品．逾 11 000 名人士于平台上注册成为会员,200000,200000,200000,9.00,9.00,9.00,Completed,已完成,已完成,https://g6pdia.com/,https://g6pdia.com/,https://g6pdia.com/
Green Care,愛共享‧二手復康用品轉售及租借平台,爱共享‧二手复康用品转售及租借平台,Hong Kong Young Women's Christian Association,香港基督教女青年會,香港基督教女青年会,Innovative Project/Venture,創新計劃,创新计划,Impact Incubator programme run by the Hong Kong Council of Social Service,由香港社會服務聯會推展的Impact Incubator 計劃,由香港社会服务联会推展的Impact Incubator 计划,Start-up,初創,初创,Healthcare,醫,医,Elderly,長者,长者,Online sale and rental services of rehabilitation products to cater for the needs of the disabled,照顧長者及殘疾人士需要的二手復康用品轉售及租借網上平台,照顾长者及残疾人士需要的二手复康用品转售及租借网上平台,"‧Launched the 'Green Care' trading platform for resale and hire services of rehabilitation products.‧Collected and repaired over 570 pieces of used rehabilitation products. Among these, about 180 pieces were sold or donated to needy families.‧Recruited a team of wheelchair technicians.",‧推出Green Care 「二手復康用品轉售及租借平台」‧收集及修復超過570件復康用品並已售出或轉贈約180件予有需要家庭‧組成輪椅維修義工隊,‧推出Green Care 「二手复康用品转售及租借平台」‧收集及修复超过570件复康用品并已售出或转赠约180件予有需要家庭‧组成轮椅维修义工队,200000,200000,200000,12.00,12.00,12.00,Completed,已完成,已完成,ycnd.ywca.org.hk,ycnd.ywca.org.hk,ycnd.ywca.org.hk
Heightened Senses,心視界,心视界,Heightened Senses Limited,心視界有限公司,心视界有限公司,Innovative Project/Venture,創新計劃,创新计划,Good Seed programme run by the PolyU Technology and Consultancy Co Ltd,由理大科技及顧問有限公司推展的「好薈社」計劃,由理大科技及顾问有限公司推展的「好荟社」计划,Prototype,原型,原型,Job training and opportunities,工作培訓和就業機會,工作培训和就业机会,Persons with disabilities,殘疾人士,残疾人士,Training on massage for the visually-impaired to help them earn a living with a profession,為視障人士提供按摩培訓讓他們可以憑專業技能謀生,为视障人士提供按摩培训让他们可以凭专业技能谋生,22 visually-impaired persons trained as masseurs,完成培訓22名視障人士成爲按摩師,完成培训22名视障人士成为按摩师,200000,200000,200000,6.00,6.00,6.00,Completed,已完成,已完成,https://www.facebook.com/heightenedsenses4/,https://www.facebook.com/heightenedsenses4/,https://www.facebook.com/heightenedsenses4/
Hijab Running with South Asian Women ,逆走巾幗：少數族裔女性跑起來,逆走巾帼：少数族裔女性跑起来,Sports Event Planner Limited,體育活動策劃專家有限公司,体育活动策划专家有限公司,Innovative Project/Venture,創新計劃,创新计划,Good Seed programme run by the PolyU Technology and Consultancy Co Ltd,由理大科技及顧問有限公司推展的「好薈社」計劃,由理大科技及顾问有限公司推展的「好荟社」计划,Prototype,原型,原型,Community participation,社區參與,社区参与,People of diverse race,不同種族人士,不同种族人士,Providing training in long-distance running for women of diverse race and local Chinese women,向不同種族的婦女與本地華裔婦女提供長跑訓練,向不同种族的妇女与本地华裔妇女提供长跑训练,Engage 80 women of diverse race and 40 local Chinese women in long-distance running training,80位不同種族婦女與40位本地華裔婦女參與長跑訓練,80位不同种族妇女与40位本地华裔妇女参与长跑训练,200000,200000,200000,9.00,9.00,9.00,Active,推展中,推展中,,,
Hollo,樹洞,树洞,Hollo Limited,樹洞科技有限公司,树洞科技有限公司,Innovative Project/Venture,創新計劃,创新计划,Good Seed programme run by the PolyU Technology and Consultancy Co Ltd,由理大科技及顧問有限公司推展的「好薈社」計劃,由理大科技及顾问有限公司推展的「好荟社」计划,Prototype,原型,原型,Healthcare,醫,医,Children and youth,兒童及青少年,儿童及青少年,Developing a tech-based personal health management tool to enhance therapeutic services,研發以科技為基礎的個人健康管理工具以提升治療服務,研发以科技为基础的个人健康管理工具以提升治疗服务,，Completed the development of the mobile application for persons with potential mental illness，Completed the development of the web-/app-based dashboard prototype for supporting the therapeutic services in NGOs，Reached 1 200 individuals with potential mental illness,，完成研發為具有潛在精神病患的人士而設的流動應用程式，完成研發為支援非政府機構提供康復治療的網上儀表板，接觸 1 200 位具有潛在精神病患的人士,，完成研发为具有潜在精神病患的人士而设的流动应用程式，完成研发为支援非政府机构提供康复治疗的网上仪表板，接触 1 200 位具有潜在精神病患的人士,200000,200000,200000,9.00,9.00,9.00,Completed,已完成,已完成,,,
Kam Tin Earth Farm,錦田地球農村,锦田地球农村,One Earth Co-Farm Limited,一地共農有限公司,一地共农有限公司,Innovative Project/Venture,創新計劃,创新计划,Good Seed programme run by the PolyU Technology and Consultancy Co Ltd,由理大科技及顧問有限公司推展的「好薈社」計劃,由理大科技及顾问有限公司推展的「好荟社」计划,Prototype,原型,原型,Food,食,食,People of diverse race,不同種族人士,不同种族人士,Recruiting women of diverse race to participate in farming and food production,招募不同種族婦女參與農耕和食品製作,招募不同种族妇女参与农耕和食品制作,Engage 20 women of diverse race residing in Kam Tin and provide them with training in farming and food production,招募20位居於錦田的不同種族婦女，並為她們提供農耕和食品製作培訓,招募20位居于锦田的不同种族妇女，并为她们提供农耕和食品制作培训,200000,200000,200000,9.00,9.00,9.00,Active,推展中,推展中,,,
Life-Like Sound Field For Hearing Aids,親歷聲助聽器,亲历声助听器,Linkear Hearing Technology Limited,聆機科技有限公司,聆机科技有限公司,Innovative Project/Venture,創新計劃,创新计划,Good Seed programme run by the PolyU Technology and Consultancy Co Ltd,由理大科技及顧問有限公司推展的「好薈社」計劃,由理大科技及顾问有限公司推展的「好荟社」计划,Prototype,原型,原型,Living,住,住,Persons with disabilities,殘疾人士,残疾人士,Developing a technology to reproduce life-like sound to bring convenience to persons with hearing impairment,研發可以重現類近現實聲音的技術，為聽障人士的日常生活帶來方便,研发可以重现类近现实声音的技术，为听障人士的日常生活带来方便,Completed the interview with 12 hearing-aid users and the development of a prototype with life-like sound technology,完成訪問12名聽障人士及研發可以重現類近現實聲音的產品原型,完成访问12名听障人士及研发可以重现类近现实声音的产品原型,200000,200000,200000,9.00,9.00,9.00,Active,推展中,推展中,,,
Mealingful,軟膳點,软膳点,Mealingful Limited,Mealingful Limited,Mealingful Limited,Innovative Project/Venture,創新計劃,创新计划,Good Seed programme run by the PolyU Technology and Consultancy Co Ltd,由理大科技及顧問有限公司推展的「好薈社」計劃,由理大科技及顾问有限公司推展的「好荟社」计划,Prototype,原型,原型,Food,食,食,Elderly,長者,长者,An online soft meal ordering and delivery platform that connects providers with customers,連繫供應商和顧客的網上軟餐訂購及送遞平台,连系供应商和顾客的网上软餐订购及送递平台,Set up a soft meal ordering and delivery platform to provide 5 660 sets of soft meals to the elderly and caregivers,設立一個軟餐訂購及送遞平台，為長者及照顧者提供5 660份軟餐,设立一个软餐订购及送递平台，为长者及照顾者提供5 660份软餐,200000,200000,200000,9.00,9.00,9.00,Active,推展中,推展中,www.mealingful.hk,www.mealingful.hk,www.mealingful.hk
MEDeliver,MEDeliver,MEDeliver,MEDPOT Limited,依藥盒有限公司,依药盒有限公司,Innovative Project/Venture,創新計劃,创新计划,Impact Incubator programme run by the Hong Kong Council of Social Service,由香港社會服務聯會推展的Impact Incubator 計劃,由香港社会服务联会推展的Impact Incubator 计划,Prototype,原型,原型,Healthcare,醫,医,Elderly,長者,长者,Facilitating elderly patients to have access to smart medication management service,協助長者病人獲得智能藥物管理服務,协助长者病人获得智能药物管理服务,N/A,不適用,不适用,200000,200000,200000,12.00,12.00,12.00,Terminated,已終止,已终止,www.facebook.com/MedPOThk/,www.facebook.com/MedPOThk/,www.facebook.com/MedPOThk/
NeuroFit,NeuroFit,NeuroFit,(Individual),（個人）,（个人）,Innovative Project/Venture,創新計劃,创新计划,Impact Incubator programme run by the Hong Kong Council of Social Service,由香港社會服務聯會推展的Impact Incubator 計劃,由香港社会服务联会推展的Impact Incubator 计划,Prototype,原型,原型,Healthcare,醫,医,Elderly,長者,长者,A gamified training platform for elderly with cognitive decline or impairment ,為認知退化或認知障礙長者而設的遊戲化訓練平台,为认知退化或认知障碍长者而设的游戏化训练平台,•To improve the quality of health of 400 elderly and 400 MCI patients •15 elderly centres to subscribe the service,•改善400位長者和400位輕度認知障礙患者的健康•15間長者中心訂購服務,•改善400位长者和400位轻度认知障碍患者的健康•15间长者中心订购服务,200000,200000,200000,12.00,12.00,12.00,Active,推展中,推展中,,,
Online Elderly Diet Consultant,教煮耆食,教煮耆食,Mrs Cooky Limited,教煮太太有限公司,教煮太太有限公司,Innovative Project/Venture,創新計劃,创新计划,Impact Incubator programme run by the Hong Kong Council of Social Service,由香港社會服務聯會推展的Impact Incubator 計劃,由香港社会服务联会推展的Impact Incubator 计划,Prototype,原型,原型,Food,食,食,Elderly,長者,长者,To collaborate with nutritionists and housewives to design recipes for elderly with hypertension and diabetes,與營養師和家庭主婦合作，為患有高血壓和糖尿病的長者設計食譜,与营养师和家庭主妇合作，为患有高血压和糖尿病的长者设计食谱,•To publish and distribute about 3 000 pamphlets of hypertension and diabetes recipes to elderly care centres•To produce 120 episodes of cooking videos which will be available on social media,•出版並派發約3 000份載有適合高血壓和糖尿病患者的食譜的小冊子予長者護理中心•製作120套烹飪影片於社交媒體上發佈,•出版并派发约3 000份载有适合高血压和糖尿病患者的食谱的小册子予长者护理中心•制作120套烹饪影片于社交媒体上发布,200000,200000,200000,18.00,18.00,18.00,Active,推展中,推展中,,,
"Project Hap Sap – "" Elderly Wellbeing & Built Environment "" ",合十企画,合十企画,(Individual),（個人）,（个人）,Innovative Project/Venture,創新計劃,创新计划,Impact Incubator programme run by the Hong Kong Council of Social Service,由香港社會服務聯會推展的Impact Incubator 計劃,由香港社会服务联会推展的Impact Incubator 计划,Prototype,原型,原型,Community participation,社區參與,社区参与,Elderly,長者,长者,Diverse activities to nurture elderly people to be assessors and auditors of buildings and city designs,透過不同活動培訓長者成為建築物和城市設計的評估員及審核員,透过不同活动培训长者成为建筑物和城市设计的评估员及审核员,"•To engage 30 elderly•To engage 60 design/building professionals, 30 students and 100 members of the public to join the project•To develop a prototype set of guidelines on building an age-friendly city",•30名長者參與•60名設計/建築專業人士、30名學生及100名公眾人士參與項目•推出一套關於建設長者友善城市的指引原型,•30名长者参与•60名设计/建筑专业人士、30名学生及100名公众人士参与项目•推出一套关于建设长者友善城市的指引原型,200000,200000,200000,12.00,12.00,12.00,Active,推展中,推展中,,,
Project LEARNT,半讀工房,半读工房,Project Learnt Limited,半讀工房有限公司,半读工房有限公司,Innovative Project/Venture,創新計劃,创新计划,Good Seed programme run by the PolyU Technology and Consultancy Co Ltd,由理大科技及顧問有限公司推展的「好薈社」計劃,由理大科技及顾问有限公司推展的「好荟社」计划,Prototype,原型,原型,Education and learning,教育與學習,教育与学习,Children and youth,兒童及青少年,儿童及青少年,Utilising idle time of a restaurant to provide co-learning spaces for students,利用餐廳的閒置時間為學生提供共同學習空間,利用餐厅的闲置时间为学生提供共同学习空间,- Provide on-site academic support to 533 students- Engage a total of 30 surplus/pre-service teachers or private tutors- Provide job opportunities to 8 evening school students,- 為533名學生提供現場學習支- 合共30名超額教師、職前教師或補習導師參與- 提供工作機會予8位夜校學生,- 为533名学生提供现场学习支- 合共30名超额教师、职前教师或补习导师参与- 提供工作机会予8位夜校学生,200000,200000,200000,12.00,12.00,12.00,Active,推展中,推展中,www.study-work.hk,www.study-work.hk,www.study-work.hk
SENiA,SENiA,SENiA,COGNIVAL LIMITED,概念圖有限公司,概念图有限公司,Innovative Project/Venture,創新計劃,创新计划,Good Seed programme run by the PolyU Technology and Consultancy Co Ltd,由理大科技及顧問有限公司推展的「好薈社」計劃,由理大科技及顾问有限公司推展的「好荟社」计划,Prototype,原型,原型,Healthcare,醫,医,Children and youth,兒童及青少年,儿童及青少年,Developing an online platform for assessment of Attention Deficit / Hyperactivity Disorder for children from low-income families,研發網上平台，為低收入家庭兒童提供專注力不足/過度活躍症評估,研发网上平台，为低收入家庭儿童提供专注力不足/过度活跃症评估,- Develop an online assessment platform prototype with 3 games- Conduct assessment for 160 children aged 4 to 7,- 研發設有3個遊戲的網上評估平台原型- 為160位4至7歲兒童進行評估,- 研发设有3个游戏的网上评估平台原型- 为160位4至7岁儿童进行评估,200000,200000,200000,9.00,9.00,9.00,Active,推展中,推展中,,,
Signtoon,智手通,智手通,CLOZEUPP AUTO TECH LIMTIED,高素自動技術有限公司,高素自动技术有限公司,Innovative Project/Venture,創新計劃,创新计划,Good Seed programme run by the PolyU Technology and Consultancy Co Ltd,由理大科技及顧問有限公司推展的「好薈社」計劃,由理大科技及顾问有限公司推展的「好荟社」计划,Prototype,原型,原型,Living,住,住,Persons with disabilities,殘疾人士,残疾人士,Developing a sign language translation system as an aid for communicating with the hearing impaired,研發手語翻譯系統以改善與聽障人士的溝通,研发手语翻译系统以改善与听障人士的沟通,- Develop a Signtoon kiosk and a Signtoon text to sign language translator- Engage 30 hearing impaired persons to conduct user interview,- 研發一個智手通資訊站和智手通文字手語翻譯機- 與30位聽障人士進行用家訪問,- 研发一个智手通资讯站和智手通文字手语翻译机- 与30位听障人士进行用家访问,200000,200000,200000,9.00,9.00,9.00,Active,推展中,推展中,http://www.clozeupp.hk/,http://www.clozeupp.hk/,http://www.clozeupp.hk/
Silver Kitchen,膳頤廚房,膳颐厨房,Silver Foods Technology Limited,膳頤食品科技有限公司,膳颐食品科技有限公司,Innovative Project/Venture,創新計劃,创新计划,Good Seed programme run by the PolyU Technology and Consultancy Co Ltd,由理大科技及顧問有限公司推展的「好薈社」計劃,由理大科技及顾问有限公司推展的「好荟社」计划,Prototype,原型,原型,Food,食,食,Elderly,長者,长者,Developing a new technology to provide soft food for elderly’s easy consumption,研發新技術，為長者提供容易進食的軟食物,研发新技术，为长者提供容易进食的软食物,Designed and developed 36 types of elderly food for testing,完成研發36款適合長者進食的食品作先導測試,完成研发36款适合长者进食的食品作先导测试,200000,200000,200000,9.00,9.00,9.00,Completed,已完成,已完成,www.silverfoods.tech,www.silverfoods.tech,www.silverfoods.tech
Soul Smile Food Factory,微笑軟餐館,微笑软餐馆,Sweet Stories Limited ,甜蜜故事有限公司,甜蜜故事有限公司,Innovative Project/Venture,創新計劃,创新计划,Impact Incubator programme run by the Hong Kong Council of Social Service,由香港社會服務聯會推展的Impact Incubator 計劃,由香港社会服务联会推展的Impact Incubator 计划,Prototype,原型,原型,Food,食,食,Elderly,長者,长者,A training programme for caregivers and volunteers on cooking and serving of soft food for the elderly,培訓課程教導照顧者和義工為長者烹調和餵食軟餐,培训课程教导照顾者和义工为长者烹调和喂食软餐,"•To design 20 recipes of soft food which will be compiled into a cookbook for publication•To benefit 240 elderly, 120 caregivers or volunteers",•設計20款軟餐食譜，並結集成烹飪書出版•讓240位長者和120位照顧者或義工受惠,•设计20款软餐食谱，并结集成烹饪书出版•让240位长者和120位照顾者或义工受惠,200000,200000,200000,12.00,12.00,12.00,Active,推展中,推展中,,,
TeaTimes,點聚,点聚,TeaTimes Media Limited,點聚媒體有限公司,点聚媒体有限公司,Innovative Project/Venture,創新計劃,创新计划,Good Seed programme run by the PolyU Technology and Consultancy Co Ltd,由理大科技及顧問有限公司推展的「好薈社」計劃,由理大科技及顾问有限公司推展的「好荟社」计划,Prototype,原型,原型,Community participation,社區參與,社区参与,Persons with disabilities,殘疾人士,残疾人士,Establishing an online platform to provide information on disabled-friendly entertainment and leisure activities,建立線上平台提供適合殘疾人士的消閒娛樂活動資訊,建立线上平台提供适合残疾人士的消闲娱乐活动资讯,- Establish an online search platform to provide information on disabled-friendly entertainment and leisure activities- Collaborate with 8 organisers of disabled-friendly activities and 1 transport service provider- Provide information of at least 20 disabled-friendly activities on the online search platform,- 建立一個線上搜尋平台，提供適合殘疾人士的消閒娛樂活動資訊- 與8個舉辦適合殘疾人士的活動的機構和1個交通服務供應商合作- 線上搜尋平台提供最少20個適合殘疾人士的活動資訊,- 建立一个线上搜寻平台，提供适合残疾人士的消闲娱乐活动资讯- 与8个举办适合残疾人士的活动的机构和1个交通服务供应商合作- 线上搜寻平台提供最少20个适合残疾人士的活动资讯,200000,200000,200000,9.00,9.00,9.00,Active,推展中,推展中,teatimeshk.com,teatimeshk.com,teatimeshk.com
耆義之手 - 3D中風手支架,耆義之手 - 3D中風手支架,耆义之手 - 3D中风手支架,(Individual),（個人）,（个人）,Innovative Project/Venture,創新計劃,创新计划,Impact Incubator programme run by the Hong Kong Council of Social Service,由香港社會服務聯會推展的Impact Incubator 計劃,由香港社会服务联会推展的Impact Incubator 计划,Prototype,原型,原型,Healthcare,醫,医,Elderly,長者,长者,Using 3D printing to produce affordable hand exoskeletons for stroke rehabilitation,利用3D打印技術，以可負擔的價格生產中風復康治療手支架,利用3D打印技术，以可负担的价格生产中风复康治疗手支架,"•To produce 60 sets of assistive hand exoskeleton, of which 40 sets will be offered to elderly stroke patients for free",•生產60套輔助手支架，其中40套將免費贈予中風長者,•生产60套辅助手支架，其中40套将免费赠予中风长者,200000,200000,200000,18.00,18.00,18.00,Active,推展中,推展中,,,
鄉郊綠耆建新生,鄉郊綠耆建新生,乡郊绿耆建新生,PuYU Horticultural Therapy Services Limited,蒲寓園藝治療服務有限公司,蒲寓园艺治疗服务有限公司,Innovative Project/Venture,創新計劃,创新计划,Impact Incubator programme run by the Hong Kong Council of Social Service,由香港社會服務聯會推展的Impact Incubator 計劃,由香港社会服务联会推展的Impact Incubator 计划,Prototype,原型,原型,Healthcare,醫,医,Elderly,長者,长者,Engaging the elderly in Sai Kung to design and build a community garden to foster social inclusion,邀請西貢長者參與設計及建造社區園圃以促進社會共融,邀请西贡长者参与设计及建造社区园圃以促进社会共融,N/A,不適用,不适用,200000,200000,200000,12.00,12.00,12.00,Terminated,已終止,已终止,www.puyuhk.com,www.puyuhk.com,www.puyuhk.com
